{
  "protocol_version": "1.0",
  "phase": "context",
  "depth": 2,
  "limit": 3,
  "signature": "fn process_user(user: User) -> Result[Int, AppError] requires user.age >= 0 ensures true",
  "target": {
    "name": "process_user",
    "kind": "function",
    "signature": "fn process_user(user: User) -> Result[Int, AppError] requires user.age >= 0 ensures true",
    "module": "demo.context.workflow"
  },
  "dependencies": [
    {
      "name": "AppError",
      "kind": "enum",
      "signature": "enum AppError { InvalidInput }",
      "module": "demo.context.workflow",
      "relation": "signature_type",
      "distance": 1
    },
    {
      "name": "User",
      "kind": "struct",
      "signature": "struct User { age: Int } invariant age >= 0",
      "module": "demo.context.models",
      "relation": "signature_type",
      "distance": 1,
      "invariant": "age >= 0"
    },
    {
      "name": "validate_user",
      "kind": "function",
      "signature": "fn validate_user(user: User) -> Bool requires user.age >= 0 ensures result == true",
      "module": "demo.context.validators",
      "relation": "call",
      "distance": 1,
      "requires": "user.age >= 0",
      "ensures": "result == true"
    }
  ],
  "callers": [
    {
      "name": "orchestrate",
      "signature": "fn orchestrate() -> Int",
      "module": "demo.context.app",
      "distance": 1
    },
    {
      "name": "test_process_user_ok",
      "signature": "fn test_process_user_ok() -> Int",
      "module": "demo.context.tests",
      "distance": 1
    },
    {
      "name": "main",
      "signature": "fn main() -> Int",
      "module": "demo.context.app",
      "distance": 2
    }
  ],
  "contracts": {
    "requires": "user.age >= 0",
    "ensures": "true"
  },
  "related_tests": [
    "demo.context.tests.test_process_user_ok"
  ]
}
